1|Practical Plastic Chips|Quia magni aut doloremque doloremque magnam dolor dolores.|Voluptatibus eum sint molestiae incidunt aperiam. Architecto ut facilis iste eveniet accusamus ex.|Fish|$17.00
2|Small Wooden Bacon|Tempora ratione id quidem repellat amet natus sunt doloribus vitae.|Expedita doloremque quisquam facere assumenda qui est et. Sunt vel incidunt blanditiis fugiat saepe dolor qui nihil.|Shirt|$309.00
3|Practical Cotton Bike|Expedita minus magni vitae est aperiam.|Quis molestiae ab atque. Doloribus veniam qui sint esse sunt est dolor.|Chicken|$139.00
4|Handmade Fresh Bike|In voluptatem quia harum beatae necessitatibus.|Blanditiis enim omnis. Incidunt assumenda ea modi possimus odio dignissimos.|Fish|$933.00
5|Small Fresh Towels|Voluptatem ut eos et vitae quisquam necessitatibus maxime.|Aut incidunt sequi aspernatur consequatur occaecati mollitia eos. Rerum ullam porro.|Car|$907.00
6|Rustic Plastic Towels|Aspernatur voluptatum esse.|Illo optio velit et consectetur distinctio ullam velit quia rerum. Sed saepe voluptatem sed.|Bike|$109.00
7|Licensed Steel Keyboard|Itaque voluptatem iste.|Aut beatae itaque quia quod voluptas enim ad. Quia quia rem et illo ea in.|Gloves|$593.00
8|Sleek Metal Bike|Voluptatem quis incidunt qui commodi aut.|Laudantium enim enim sequi aut iusto necessitatibus nostrum quibusdam accusantium. Ut tempore dolorem magni officia.|Towels|$60.00
9|Handcrafted Plastic Shoes|Totam perferendis vel id aut libero dolorum doloribus.|Perspiciatis rerum quia perferendis. Saepe et vel sit voluptatem repudiandae ipsum explicabo est.|Table|$215.00
10|Unbranded Soft Hat|Mollitia adipisci maxime.|Sed iusto tempora sapiente eum delectus aut quaerat voluptate. Similique officia itaque.|Bacon|$192.00
11|Fantastic Metal Gloves|Quia aliquid dolor.|In maxime illum officia. Asperiores deserunt ut veniam.|Pants|$610.00
12|Rustic Concrete Hat|Delectus dolor quae et.|Officia voluptatibus et exercitationem dolorum eveniet voluptatem qui assumenda qui. Est dolores quasi amet rerum excepturi.|Mouse|$479.00
13|Handcrafted Fresh Salad|Veniam et rerum rem unde est numquam ea similique.|Quisquam amet natus ut dolore vero et. Omnis qui quod omnis facilis et vel.|Tuna|$305.00
14|Fantastic Rubber Towels|Quis nulla totam voluptates laborum non pariatur delectus.|Ut minima tenetur doloribus ratione possimus doloribus porro ad id. Qui non mollitia labore.|Gloves|$790.00
15|Ergonomic Cotton Mouse|Perferendis quia veniam ipsa dolorem non ut laboriosam.|Facilis excepturi qui et ipsum veniam ratione facere delectus eius. Quas ratione sit iste aut aut fugiat vel.|Bacon|$228.00
16|Generic Wooden Car|Est nulla doloribus iure qui atque dolores iste dolore voluptatem.|Architecto aliquam non incidunt quisquam blanditiis sed. Est nesciunt qui tempora animi qui voluptatem id eum.|Towels|$383.00
17|Practical Steel Cheese|Consequatur voluptatem ipsum velit iste enim doloremque voluptas.|Voluptatum sed rerum ab sit dolor. Quam porro a quas ab ab fugit provident rerum possimus.|Chair|$621.00
18|Handmade Concrete Towels|Minima eum labore nulla harum laudantium maiores impedit.|Eos distinctio qui veniam et et minus non quae. In porro corrupti necessitatibus itaque aut quam ea doloribus optio.|Bacon|$511.00
19|Handcrafted Frozen Salad|Porro similique perspiciatis distinctio harum reiciendis iste numquam voluptatum voluptas.|Suscipit qui voluptas suscipit quia et magnam ut quidem. Ea in non.|Pants|$225.00
20|Sleek Steel Chair|Non qui corporis veritatis et suscipit.|Et fuga magni. Eligendi libero ipsa aut.|Fish|$448.00
21|Ergonomic Wooden Keyboard|Enim molestiae ipsam earum.|Debitis sunt est architecto officiis. Sequi asperiores aspernatur molestiae.|Chicken|$433.00
22|Awesome Fresh Bacon|Maxime et quo consequatur libero assumenda.|Aut animi perspiciatis ipsam doloremque repellendus in consequatur sint. Omnis quas velit.|Pizza|$804.00
23|Handcrafted Plastic Shoes|Velit excepturi et et perferendis.|Molestiae fugit et tenetur quae omnis et totam. Et aliquid veritatis a est vero est explicabo officiis ratione.|Cheese|$841.00
24|Gorgeous Wooden Fish|Ut repudiandae quia distinctio veniam ullam dolorum.|Ex dignissimos est eaque rem nihil eveniet omnis dolorem vitae. Quia fugiat sint est alias ratione aut nisi.|Salad|$270.00
25|Handcrafted Cotton Ball|Optio vitae est ipsam fuga.|Laudantium saepe aliquid laboriosam excepturi eos blanditiis est aut. Perferendis doloremque blanditiis non qui ut aut.|Ball|$63.00
26|Fantastic Frozen Sausages|Possimus repellendus dolorem.|Culpa ducimus perferendis eius quia sint dolor dolores. Rerum ut hic temporibus.|Shoes|$105.00
27|Gorgeous Rubber Bacon|Voluptates qui reiciendis.|Laboriosam dolor recusandae aut odit et voluptate illo pariatur provident. Ab nulla est doloremque.|Pizza|$877.00
28|Handmade Cotton Cheese|Libero nobis debitis maiores repudiandae aut omnis suscipit.|Hic non velit modi qui voluptates nihil esse ut dolores. Ut ut laudantium eum soluta.|Bacon|$480.00
29|Practical Frozen Fish|Suscipit sit ea possimus sequi eaque.|Sequi et aliquam eius molestiae excepturi sit esse. Et incidunt laudantium eaque distinctio magni repellat dolor sit.|Mouse|$649.00
30|Gorgeous Rubber Pants|Eligendi quo asperiores sunt.|Quia esse aut. Reiciendis est incidunt praesentium blanditiis nesciunt.|Towels|$667.00
31|Awesome Rubber Car|Aspernatur consequuntur aut.|Officiis ut aliquid magnam deserunt voluptatem iusto. Iste rerum qui.|Chair|$21.00
32|Gorgeous Wooden Cheese|Quis et voluptas sed quis quam recusandae rerum enim odit.|Distinctio iste id sed est. Beatae enim perferendis qui iure id.|Towels|$784.00
33|Awesome Steel Shoes|Occaecati vitae aut voluptatem voluptatem nostrum quisquam.|Nulla officia beatae illo nihil expedita alias qui. Dicta tempore voluptas enim mollitia consequatur.|Towels|$380.00
34|Incredible Cotton Ball|Aut et rerum sit dolore.|Qui aspernatur repellat perferendis. Qui vel soluta.|Ball|$168.00
35|Sleek Fresh Cheese|Earum et aperiam facilis harum veritatis facere ipsa.|Itaque illo sit ut nemo dolorem alias. Quia cum et.|Mouse|$198.00
36|Licensed Frozen Soap|Aliquam vitae sunt aperiam sunt et rerum et.|Soluta tempore qui optio. Qui voluptas voluptas voluptas nihil odit itaque molestiae.|Chips|$498.00
37|Small Steel Sausages|Illo non numquam sit voluptatem consequuntur beatae accusantium.|Odio beatae impedit sed ratione illo saepe cupiditate ea. Labore qui et dolorem natus ad quo possimus rerum repellendus.|Ball|$421.00
38|Rustic Steel Bike|Qui exercitationem qui error provident doloremque ab sint exercitationem ut.|Quis neque dolores omnis vero voluptas dignissimos molestias animi. Voluptas accusamus qui hic aut alias et delectus aperiam.|Pizza|$52.00
39|Fantastic Concrete Keyboard|Doloribus possimus in dolores nihil totam ratione optio non quam.|Et amet ratione omnis tempora quasi. Blanditiis quae ipsam et eaque perferendis velit quia.|Chicken|$559.00
40|Intelligent Fresh Soap|Id ipsam doloribus consectetur delectus.|Quia sed repellendus eos. Pariatur numquam et quia vel quam corporis aut ex.|Tuna|$372.00
41|Handmade Concrete Chicken|Et cum dolores omnis minus officiis neque voluptatem.|Pariatur dolorem accusantium neque molestias blanditiis aut ipsa animi voluptatem. Recusandae beatae vel eum fugit.|Salad|$154.00
42|Fantastic Cotton Cheese|Harum distinctio doloribus ea distinctio modi et.|Eos voluptas omnis eligendi ut et voluptatem quae. Mollitia possimus maiores consequatur qui explicabo.|Chicken|$592.00
43|Refined Granite Chips|Aut nemo quod sed itaque sit veritatis.|Dicta reprehenderit quisquam. Eum beatae veritatis autem ut.|Car|$669.00
44|Tasty Concrete Bacon|Aperiam iusto similique illum eum.|Placeat aspernatur voluptatem rem et qui sit est. Earum occaecati ea.|Tuna|$357.00
45|Refined Granite Gloves|Vel quia atque.|Rerum similique natus consequuntur. Fugiat culpa autem.|Shirt|$781.00
46|Tasty Granite Ball|In dolor et molestias ipsam dolores sunt rerum.|Magni veritatis exercitationem possimus voluptatem voluptatem. Id distinctio et et illo veniam odio ut error.|Tuna|$521.00
47|Handcrafted Steel Tuna|Natus aliquam quod excepturi accusantium perferendis dolorem.|Est odit provident. Aut voluptas dolorem.|Mouse|$858.00
48|Ergonomic Cotton Chair|Ut in repellat delectus veniam.|Omnis et doloremque aliquam. Eligendi ex sit.|Ball|$651.00
49|Practical Fresh Computer|Maxime sed distinctio doloremque.|Rerum ex asperiores libero. Aut facere in non impedit recusandae.|Towels|$660.00
50|Fantastic Concrete Towels|Voluptas voluptas iusto repellat est.|Nostrum praesentium ipsum illum omnis quae labore debitis sed dolore. Et officiis inventore velit nisi at ab odio cupiditate iste.|Chair|$225.00
51|Refined Wooden Table|Sint iusto sed ipsam.|Qui sed cupiditate iste. Totam iure non vel saepe doloribus dolores.|Salad|$800.00
52|Intelligent Fresh Tuna|Quidem doloribus quidem consequatur sequi omnis ex vel ratione laudantium.|Et nulla officia voluptatem excepturi nemo. Iusto rerum aliquam nihil.|Sausages|$688.00
53|Licensed Wooden Shirt|Pariatur repudiandae aut dolorem voluptatem sint alias et.|Minima error ut alias qui ut. Iure error est.|Table|$910.00
54|Handcrafted Steel Chicken|Autem repellat porro porro harum qui placeat aut corporis.|Eius hic sit officia architecto consectetur consequatur debitis. Illo voluptatem numquam quasi.|Chips|$717.00
55|Ergonomic Granite Ball|Velit reprehenderit dicta.|Unde saepe rerum inventore. Perferendis dolores nulla distinctio autem.|Soap|$398.00
56|Rustic Cotton Table|Doloremque qui aperiam.|Officiis debitis dolor rerum dolorem repudiandae sed sit maxime eum. Placeat placeat numquam modi dolor consequatur.|Bike|$947.00
57|Handcrafted Granite Chicken|Et veniam soluta tenetur facere saepe.|Repellat aut sit nihil reprehenderit non consequatur et et. Sunt veniam facere aut.|Sausages|$739.00
58|Licensed Metal Salad|Aperiam sit quibusdam.|Et est suscipit explicabo. Asperiores non vero voluptatum quae odit.|Chicken|$152.00
59|Awesome Soft Bacon|Et aliquam aut et consequuntur.|Aut aliquid sit sed repellat ipsa. Aut modi nulla porro aperiam debitis fugit molestiae quia sunt.|Sausages|$424.00
60|Rustic Rubber Car|Vel nam non corrupti facilis qui cum sed.|Animi cum et eos sunt minima non. Quis nesciunt molestias sed ut dignissimos quidem.|Pizza|$85.00
61|Handmade Frozen Pants|Cumque adipisci molestiae cum officiis assumenda ut.|Delectus hic enim nulla. Cumque fugit aliquam nesciunt consequuntur repellendus.|Keyboard|$24.00
62|Sleek Wooden Car|Rem molestiae non natus temporibus facere.|In harum voluptatem. Id ab dolores dicta voluptatem labore hic nobis.|Bike|$770.00
63|Intelligent Rubber Hat|Molestias assumenda eum.|Autem omnis omnis natus voluptas ut voluptatibus natus illo amet. Itaque voluptatum voluptates distinctio aut.|Chair|$207.00
64|Small Granite Salad|Perspiciatis placeat quidem.|Dignissimos sit ullam facere. Tenetur quia ad et quaerat at nulla in.|Sausages|$729.00
65|Incredible Frozen Pizza|Ipsa voluptas excepturi ut.|Eos voluptatem et. Qui eum perferendis aliquid dolores sit ut quia.|Keyboard|$981.00
66|Refined Cotton Computer|Nihil magnam facilis vel voluptatem omnis.|Culpa tempore harum. Ut quibusdam rem iure commodi dolorum ipsa voluptatem.|Ball|$625.00
67|Intelligent Fresh Salad|Doloribus ex numquam accusamus.|Enim vel dolorum repellat excepturi rem explicabo iure omnis qui. Ratione quia omnis quis corrupti ratione ullam.|Pants|$483.00
68|Tasty Fresh Bike|Libero voluptatum atque quibusdam consequatur quis.|Distinctio sapiente amet aut excepturi officia neque. Omnis quia fuga sunt in blanditiis libero tempore explicabo reprehenderit.|Mouse|$446.00
69|Awesome Wooden Chips|Qui velit in consequuntur in voluptatibus ex pariatur.|Consequuntur animi nihil eum iure magni deleniti non. Expedita illo praesentium omnis maxime.|Fish|$392.00
70|Practical Wooden Sausages|Hic est voluptatem magnam doloribus sit maiores aut perspiciatis consequatur.|Consequatur perferendis officia eum praesentium ab autem atque et. Officiis vero qui praesentium nam et debitis nesciunt accusantium.|Fish|$231.00
71|Refined Granite Pizza|Eveniet et non excepturi atque atque aut.|Sint numquam et repudiandae quasi et placeat quia minus. Asperiores quisquam qui magnam consequuntur dicta molestias molestiae tenetur qui.|Bacon|$33.00
72|Generic Wooden Pizza|Magni dolor ea sint et dolores et et blanditiis.|Iusto inventore beatae ut porro eius provident. Quia provident omnis quidem pariatur.|Keyboard|$733.00
73|Ergonomic Granite Table|Eius sequi sit omnis ut rem est vel repellat quisquam.|Dignissimos dolores eius assumenda et incidunt. Aut sit repudiandae voluptatum.|Table|$778.00
74|Fantastic Rubber Chair|Quos recusandae voluptas placeat ut.|Fugit optio quibusdam autem qui neque a nobis voluptas hic. Ut consequatur ipsum.|Gloves|$185.00
75|Sleek Granite Mouse|Ducimus assumenda velit minima provident omnis.|Nulla enim optio dolore autem ex dolor omnis voluptatem non. Modi quasi est rerum quis.|Cheese|$301.00
76|Rustic Frozen Computer|Culpa consequuntur aut ex est ipsum.|Consequuntur ea facilis. Ducimus voluptas est beatae quas accusamus vel.|Salad|$750.00
77|Intelligent Steel Chips|Ut sapiente officiis sed facilis iste.|Et harum quia quibusdam odit magni magni. Error impedit ipsa aspernatur quaerat incidunt rem necessitatibus omnis.|Keyboard|$587.00
78|Licensed Frozen Chips|Ipsam consectetur aliquid qui dicta quae error eos.|Ea omnis eum non sed aut odit. Excepturi voluptatem a vel ipsum officia et quo velit.|Cheese|$213.00
79|Refined Metal Fish|Quo voluptatum explicabo id eveniet ipsam.|Distinctio dolores laborum consequatur magni in ratione cum. Distinctio velit voluptatem.|Cheese|$641.00
80|Practical Wooden Sausages|Itaque dolor explicabo sunt quisquam aspernatur ea earum corporis.|At pariatur soluta est. Nihil quo dignissimos voluptas.|Soap|$492.00
81|Sleek Concrete Chips|Quo sapiente eos nam.|Temporibus deleniti molestias voluptatem ut sit quia error. Voluptatum illo nobis autem quae architecto.|Salad|$134.00
82|Handmade Fresh Keyboard|Est consequatur sit ullam quae dolor.|Error voluptatum hic. Aperiam nostrum porro cupiditate velit animi provident placeat debitis.|Shoes|$394.00
83|Small Frozen Chicken|Quia itaque sapiente quo eum.|Distinctio sed et commodi odit est. Facere laboriosam suscipit molestias ipsum.|Computer|$269.00
84|Handcrafted Metal Salad|Quia provident quasi eveniet autem omnis harum veniam.|Quidem fugit maxime laboriosam libero inventore. Libero incidunt error iusto voluptatem porro sint ipsa veniam.|Chips|$345.00
85|Practical Granite Chips|Eum qui iusto itaque iure officia laboriosam a enim vel.|Et est vel repellat id. Quibusdam excepturi aut eius perspiciatis.|Chair|$267.00
86|Incredible Plastic Table|Sed voluptatem consequatur assumenda exercitationem.|Consequatur ut veniam in doloremque dolores repellat saepe sit. Enim enim nisi officia dolor quod.|Soap|$838.00
87|Licensed Soft Car|Ab nam eum.|Quis qui neque tempore sapiente temporibus iure. At eos voluptatem.|Computer|$74.00
88|Ergonomic Steel Chair|Voluptatem aut quisquam.|Non rerum eligendi unde magnam hic. Omnis totam qui autem minima deleniti possimus unde tempora soluta.|Table|$584.00
89|Unbranded Rubber Chicken|Maxime aut voluptas.|Sed molestiae optio libero officiis deserunt. Aut excepturi voluptatem ullam ducimus eaque dolorem ut animi.|Cheese|$596.00
90|Unbranded Fresh Soap|Dolore magni incidunt.|Possimus quas ab ab numquam sunt dolores non. Quas magnam sint culpa eum earum autem quis explicabo eaque.|Hat|$540.00
91|Unbranded Rubber Computer|Voluptatem ut animi eligendi et non magni repellat quas temporibus.|Quam non hic ducimus id odit vitae non nisi neque. Aut beatae consequatur cumque labore necessitatibus dolorum eos est quis.|Pants|$697.00
92|Tasty Frozen Gloves|Veniam eos enim culpa beatae.|Quia praesentium quaerat corporis voluptas in voluptas. Quia consequatur autem recusandae porro magnam aliquid nulla.|Soap|$532.00
93|Awesome Soft Pizza|Odit rerum quia sint minima vel.|Nihil quo consequatur rerum natus ex commodi officia doloremque. Cumque voluptas et amet est distinctio culpa voluptatem at.|Gloves|$251.00
94|Handcrafted Frozen Soap|Sunt sint assumenda reiciendis officiis sapiente asperiores et est omnis.|Et eveniet aut animi fugit. Delectus earum voluptatem omnis eveniet id dolorum ipsum.|Fish|$288.00
95|Rustic Frozen Table|Reprehenderit iste ipsa aut sequi corrupti quidem eos totam.|Nisi repellat libero sunt et rerum voluptas inventore. Similique accusantium est repellat neque quidem expedita deleniti alias fuga.|Computer|$963.00
96|Fantastic Soft Pants|Ipsam laboriosam dolore consequuntur officia modi non praesentium.|Mollitia et est quasi. Qui placeat quas.|Pants|$542.00
97|Gorgeous Metal Chicken|Voluptatem cum voluptatem ad.|Nobis autem accusamus nam. Nihil similique quae enim quos doloribus mollitia qui.|Bike|$117.00
98|Awesome Rubber Pizza|Occaecati tempora voluptatibus quos.|Qui in velit enim ipsa ad qui. Animi quam occaecati repellendus temporibus voluptatem.|Chair|$848.00
99|Unbranded Granite Mouse|Omnis officiis accusamus.|Quidem magnam illum eius quia. Et eaque vel nihil.|Fish|$717.00
100|Intelligent Wooden Chicken|Facere modi fugit consequatur vel.|Dolorem ad at corrupti id inventore quia vero. Soluta animi et quasi eos dolores rem cumque.|Mouse|$115.00
