0|Licensed Metal Hat|Tempore non consequatur cumque ut eveniet voluptas excepturi.|Cupiditate quo nemo natus corporis est sequi est non. Aperiam recusandae nostrum ipsa atque id minima eaque sit.|Bike|$84.00
1|Sleek Rubber Keyboard|In eum accusantium corporis velit tempore.|Veritatis iusto est deserunt inventore odit iste. Delectus reprehenderit eius qui quia aliquam pariatur.|Table|$282.00
2|Unbranded Wooden Hat|Et ut fuga qui quas provident.|Molestias officiis nihil quo et culpa. Omnis sapiente dolorum eos.|Soap|$635.00
3|Gorgeous Fresh Gloves|Sequi quas rerum qui facere doloremque ex quam.|Quasi tempore totam quaerat. Voluptatibus aut officiis aspernatur qui.|Shoes|$571.00
4|Intelligent Wooden Shoes|Perspiciatis dicta nostrum tenetur labore assumenda architecto.|Autem incidunt at id. Aut consequuntur in dolorem corrupti.|Ball|$223.00
5|Ergonomic Concrete Soap|Repellendus dolore possimus a sed modi et inventore.|Sint consequatur est perferendis quibusdam est est aut et sint. Omnis eius enim nemo.|Sausages|$198.00
6|Practical Steel Car|Excepturi corporis pariatur sit eligendi et quo.|Est ut fuga maxime dolorum accusamus aut sed maxime. Expedita dolore commodi quos optio perferendis praesentium et officia.|Towels|$79.00
7|Generic Rubber Keyboard|Quia natus alias autem dolor minus sit.|Ut quia perferendis excepturi incidunt laborum cum enim suscipit. Ut facilis vero eligendi et ducimus officiis quo sit eius.|Gloves|$189.00
8|Fantastic Wooden Hat|Aliquid accusantium voluptas tenetur explicabo qui totam quia.|Consequuntur aut unde autem. Quia sed sit in consequuntur enim.|Chips|$402.00
9|Sleek Steel Chair|Quam eos temporibus ea assumenda illum et accusamus mollitia.|Laboriosam fugiat quibusdam odio repudiandae facilis ipsum expedita. Sequi atque hic placeat facilis velit quam veniam optio quis.|Sausages|$950.00
10|Handcrafted Fresh Sausages|Odit nemo modi iusto quidem ut et maiores tempora.|Consequatur temporibus et optio amet non dolores ex. Beatae veritatis illum recusandae.|Pants|$317.00
11|Small Plastic Soap|Eveniet autem facere eligendi incidunt dicta excepturi.|Facilis sit numquam esse eum tempore aspernatur possimus quia. Consequatur necessitatibus impedit enim vero error sit dignissimos quaerat laborum.|Table|$325.00
12|Refined Metal Hat|Illum rem pariatur non libero sed est nemo.|Voluptatibus voluptatem voluptas. Laborum quia voluptatem ex.|Shoes|$174.00
13|Intelligent Frozen Pants|Consequatur id aut consequatur qui voluptatibus fugiat tempore neque.|Consequatur nihil dolor est quam itaque et. Quo necessitatibus et dolor eaque sed laboriosam necessitatibus itaque.|Fish|$203.00
14|Fantastic Cotton Chair|Autem consectetur nam animi iure mollitia minus.|Nihil exercitationem aliquam eius laboriosam repudiandae. Sit sunt odit iste consequuntur deserunt iure.|Salad|$179.00
15|Handmade Soft Shoes|Nesciunt dolorem quis saepe tempore harum placeat et.|Culpa consequatur optio est et incidunt ut est. Cumque minima quidem aperiam odit modi.|Salad|$716.00
16|Handmade Wooden Sausages|Voluptas tenetur et consectetur velit velit illum exercitationem non.|Hic deleniti impedit et ea non voluptas. Porro eveniet est et eveniet ab.|Bacon|$775.00
17|Practical Soft Bacon|Ea rerum molestias quaerat.|Molestiae sunt ut modi accusantium enim laborum beatae quia natus. Quibusdam placeat quia tenetur officia beatae eius.|Chips|$447.00
18|Unbranded Soft Ball|Commodi est optio quam qui ut suscipit est.|Sed minima doloremque blanditiis voluptates exercitationem. Nam dicta voluptates ducimus in eos soluta et totam.|Table|$672.00
19|Handmade Cotton Towels|Ut maxime officiis.|Consequuntur quas iusto qui cum vel et. At debitis ex.|Shoes|$957.00
20|Handmade Steel Fish|Aut repellendus nostrum minima quaerat.|Et cumque explicabo numquam temporibus nulla. Corrupti est porro inventore voluptas magni laborum rem qui.|Mouse|$531.00
21|Fantastic Metal Computer|Ut minus qui ea autem assumenda quae tempora nihil.|Neque occaecati temporibus deleniti. Veritatis dignissimos inventore blanditiis voluptas dolores.|Shoes|$698.00
22|Fantastic Cotton Car|Expedita nihil veniam repellat eveniet rerum sint aut iusto.|Et qui perferendis. Omnis qui porro eaque illum placeat.|Chair|$215.00
23|Rustic Concrete Chicken|Magni quia pariatur delectus officiis ut.|Odio voluptates sint quibusdam optio veniam ut quasi iusto. Qui quod neque ut nobis quo sit.|Bike|$85.00
24|Rustic Concrete Soap|Blanditiis eligendi optio molestiae et aut optio et enim rerum.|Et nam eveniet dolores ullam cum vel. Eum ut voluptatem.|Chicken|$279.00
25|Gorgeous Wooden Sausages|Ipsum repellendus eos eum recusandae reprehenderit debitis.|Corporis tempora et esse quis. Nesciunt vitae cumque aut aut.|Keyboard|$874.00
26|Awesome Plastic Chair|Ea hic quibusdam.|Labore facilis libero ea neque earum rerum ut sequi est. Voluptate aspernatur ea illum maxime.|Bike|$978.00
27|Unbranded Plastic Bike|Ipsum velit non deserunt et.|Dolores voluptatem magni sit est sed sed. Dolor atque iure magni iure ullam.|Mouse|$531.00
28|Small Concrete Chair|Corrupti non recusandae consequatur maiores aut atque.|Ipsam quis molestiae ut asperiores veritatis sit. Numquam ut dicta rerum reiciendis quae id molestiae eos consequatur.|Gloves|$122.00
29|Rustic Steel Tuna|Dolorem blanditiis neque unde.|Debitis aut perspiciatis incidunt est ratione necessitatibus atque. Ad quia quo molestiae incidunt voluptas fuga quis et quasi.|Keyboard|$810.00
30|Rustic Frozen Hat|Soluta expedita consectetur provident enim quisquam.|Odit vero omnis. Optio sit reprehenderit recusandae aut et.|Computer|$352.00
31|Rustic Cotton Chair|Velit ut omnis facilis quibusdam quia doloribus quaerat quos.|Et accusantium et ea. Alias modi assumenda praesentium officiis laudantium commodi.|Gloves|$219.00
32|Intelligent Metal Gloves|Quae tenetur neque est illum ut nihil voluptatibus.|Vitae dolore laboriosam repudiandae id ut voluptatibus quia qui. Error consectetur consequatur magni.|Pizza|$606.00
33|Gorgeous Granite Gloves|Animi maiores unde maxime.|Atque ratione qui voluptatum dolor est amet facilis et. Similique perferendis optio atque in.|Sausages|$472.00
34|Licensed Steel Shoes|Blanditiis officia dolores aut voluptatibus reprehenderit autem voluptate nostrum.|Quia incidunt et dolorem facilis itaque. Occaecati ea sapiente sit iusto sint.|Car|$579.00
35|Sleek Concrete Tuna|Perferendis id nobis pariatur.|Nostrum cumque nesciunt ut rerum qui excepturi laudantium velit. In omnis soluta.|Sausages|$456.00
36|Licensed Rubber Salad|Culpa harum a qui quo ut adipisci laborum tempora nesciunt.|Voluptate consequuntur nihil dicta voluptate error placeat. Tenetur similique et non iusto maiores sint dicta quas reiciendis.|Sausages|$460.00
37|Handcrafted Metal Soap|Qui dolor enim.|Sit nihil voluptas occaecati quia voluptate maxime. Nam quas aut consequatur sunt saepe quas.|Ball|$491.00
38|Tasty Granite Hat|Et ipsum dolor ut harum necessitatibus voluptatem quibusdam vitae ut.|Voluptas reiciendis repudiandae placeat quo ut ea. Laboriosam voluptas rerum corrupti adipisci provident accusantium excepturi.|Towels|$537.00
39|Gorgeous Steel Tuna|Et dolor fuga sed exercitationem nihil temporibus illo velit.|Quidem provident sit sunt sunt voluptatem delectus dicta reprehenderit nemo. Vero voluptas in porro fuga doloribus veniam earum voluptatibus.|Mouse|$462.00
40|Unbranded Soft Chicken|Qui delectus non quam.|Debitis rerum dolorem eos quo repudiandae illum ea consectetur dignissimos. Ad sit dolores excepturi.|Shoes|$868.00
41|Ergonomic Soft Chips|Cumque ut quae aut qui.|Qui sunt porro vel esse iusto. A id consectetur.|Chips|$229.00
42|Handmade Fresh Soap|Eos cupiditate ea non cupiditate vero placeat.|Saepe similique culpa non commodi quia magnam. Mollitia odio aut sunt a hic sunt et.|Mouse|$454.00
43|Licensed Steel Soap|Eos nihil nihil est quas doloremque molestiae.|Qui quis voluptatibus hic saepe. Culpa tenetur aliquam autem blanditiis.|Soap|$758.00
44|Gorgeous Concrete Chicken|Quia enim est ipsum quam asperiores aliquid perspiciatis dignissimos.|Sunt et cupiditate. Qui natus consectetur dolorum vitae sint totam molestias.|Keyboard|$983.00
45|Rustic Granite Sausages|At natus non.|Voluptate vitae quae asperiores est et. Delectus quas quis laborum blanditiis quia modi quam ducimus est.|Table|$496.00
46|Rustic Soft Keyboard|Autem odit reiciendis repellendus quo quia aut.|Quae error in accusantium laborum eum aperiam. Neque consectetur aut in a odio aspernatur et.|Bike|$918.00
47|Handcrafted Metal Soap|Voluptas tempore sapiente ipsum impedit non animi sunt eos non.|Sunt mollitia doloribus inventore porro voluptatem. Dolorem impedit consequatur non cupiditate.|Shirt|$7.00
48|Refined Fresh Shirt|Voluptate doloribus nostrum quia neque perspiciatis est.|Dolorem pariatur rerum officia aut. Quas fuga earum adipisci veniam voluptatem illo ut.|Gloves|$444.00
49|Small Wooden Chicken|Culpa alias ex quos non aut quis est eos.|Dolor dolores aut id maxime deserunt aut id. Ipsum quia perspiciatis.|Soap|$179.00
50|Licensed Rubber Hat|Voluptatibus ratione nihil.|Officiis sit similique quibusdam consequuntur. Dignissimos nemo sint sit odit mollitia.|Chicken|$541.00
51|Tasty Cotton Chicken|Vitae nam consequuntur hic recusandae molestias sed vel corrupti libero.|Sed porro voluptatem aut adipisci. Perspiciatis culpa voluptatum accusamus necessitatibus praesentium.|Shirt|$194.00
52|Handmade Steel Ball|Quidem ipsum nemo et nesciunt voluptatum.|Corrupti illum hic nihil itaque ut dolorem ex ut in. Natus id et consequatur temporibus.|Chair|$229.00
53|Gorgeous Rubber Shirt|Totam aut dolores.|Est aut earum possimus est. Et autem dicta voluptatem qui dignissimos.|Pizza|$464.00
54|Small Rubber Bike|Commodi nostrum ipsum.|Aspernatur molestias maiores fugiat. Eos pariatur voluptates ex temporibus numquam mollitia velit.|Ball|$758.00
55|Sleek Wooden Pants|Velit fugiat occaecati.|Beatae ipsum quae ut quis magnam veritatis alias non laboriosam. Asperiores distinctio fuga maxime sit est.|Shirt|$954.00
56|Awesome Soft Bacon|Nisi omnis aliquid.|Aut ea et animi sequi. Soluta mollitia laboriosam modi.|Bike|$261.00
57|Unbranded Soft Gloves|Voluptates vel molestiae.|Libero sit autem quia dolore. Minus sunt rerum aut eum quod porro velit hic.|Table|$665.00
58|Licensed Wooden Hat|Totam eveniet vel ea praesentium.|Est aliquid et omnis in unde veritatis minima. Illo vero voluptatum reiciendis enim molestiae atque.|Pizza|$636.00
59|Incredible Granite Fish|Aut quod aperiam laborum officiis rem dicta ea sequi nobis.|Autem facilis necessitatibus expedita error sed ipsum molestias. Et itaque quae excepturi aut.|Sausages|$988.00
60|Rustic Metal Pizza|Magnam odio porro voluptas atque suscipit voluptates incidunt voluptate.|Architecto fuga est ut quia ut cum nobis itaque. Ab sit reprehenderit quas.|Chicken|$189.00
61|Gorgeous Concrete Chips|Dolor possimus facilis eos adipisci nisi.|Voluptatem magnam at recusandae quo dignissimos aut in est reprehenderit. Error qui et ut similique.|Bacon|$192.00
62|Unbranded Frozen Ball|Rerum asperiores rerum.|Voluptatem maxime quia. Quo et illum voluptatum maxime vero consequatur aliquam qui totam.|Chips|$555.00
63|Incredible Plastic Tuna|Enim asperiores eos quisquam enim eos sit aut.|Saepe explicabo voluptatem nulla et consequuntur nam dolor. Ab nemo consequatur.|Computer|$153.00
64|Practical Frozen Keyboard|Qui perferendis dolores quia delectus reiciendis facilis.|Debitis aliquid voluptas magni aspernatur. Quisquam aut debitis.|Keyboard|$394.00
65|Handmade Cotton Ball|Rerum necessitatibus officiis laborum.|Libero sit tenetur eligendi quasi qui rem. Dolorum nihil occaecati et reiciendis ad minus autem aliquam nesciunt.|Shirt|$835.00
66|Intelligent Concrete Soap|Est minima rerum esse.|Occaecati dolor commodi eveniet et aliquam. Voluptas autem voluptatum exercitationem sed in.|Pants|$763.00
67|Awesome Wooden Car|Voluptatem sunt nam sit tempore adipisci et.|Autem eum magnam consequatur aliquid porro. Laudantium vitae ut quidem.|Shirt|$248.00
68|Generic Concrete Shoes|Quia aut quae qui aspernatur enim repellendus recusandae voluptatem harum.|Quia velit et occaecati aut. Cumque quo eos rerum similique aspernatur non eos cum.|Keyboard|$320.00
69|Intelligent Soft Bacon|Laborum id recusandae dolorem expedita.|Consequatur quod quos. Dolorem modi ut doloribus reprehenderit cupiditate praesentium ut natus voluptatem.|Sausages|$796.00
70|Generic Granite Table|Qui qui similique saepe aut quos saepe dolor dignissimos.|Odio sint provident ut sunt dolor dolores quis est. Corrupti numquam voluptas qui ducimus aut saepe.|Table|$763.00
71|Unbranded Fresh Chicken|Fugit rerum aut blanditiis cumque earum error consequuntur qui.|Facere sed soluta mollitia aperiam hic rerum. Tempore ullam minus porro.|Tuna|$240.00
72|Sleek Wooden Chicken|Porro quia quis possimus atque nihil.|Nostrum excepturi quia numquam sunt. Commodi explicabo harum.|Table|$177.00
73|Intelligent Steel Shoes|Veniam dolorum vel.|Sunt vel laboriosam molestiae. Autem amet omnis molestiae quaerat.|Table|$325.00
74|Licensed Concrete Bike|Ab ipsum veniam quia id et dolores rerum pariatur minima.|Maiores debitis nostrum. Placeat repellat dicta necessitatibus nam ut sunt.|Tuna|$306.00
75|Refined Wooden Sausages|Impedit est et.|Rerum ipsam non quaerat placeat nulla qui vitae eius. Ullam sit dolor voluptatem sint et omnis.|Salad|$854.00
76|Licensed Metal Shoes|Iusto dolore porro repellat voluptatem dolores nesciunt quia commodi.|Quo cupiditate voluptas ad saepe omnis cumque sint pariatur quia. Excepturi aut repellendus saepe omnis suscipit voluptatem aut et dolore.|Computer|$173.00
77|Gorgeous Plastic Cheese|Eaque officia eaque voluptas.|Autem et accusantium ut quia temporibus eius dignissimos est aut. Veritatis quos quia.|Hat|$563.00
78|Handcrafted Fresh Soap|Expedita beatae similique inventore facere maxime saepe voluptatibus ratione quam.|Consequuntur eius sunt voluptatem saepe rerum qui autem et fugiat. Consectetur rem occaecati ut velit.|Chair|$286.00
79|Tasty Cotton Table|Aut voluptatem amet molestiae et sunt minima.|Voluptas perspiciatis neque at deleniti. Consequatur qui quisquam minus autem.|Hat|$703.00
80|Handcrafted Metal Table|Nulla soluta officia reiciendis porro.|Quod officiis est nihil esse dolores commodi voluptas sed maiores. Nisi voluptatem consequatur autem consequuntur eveniet eum et dolorum.|Car|$996.00
81|Incredible Soft Table|Nostrum omnis pariatur sint in assumenda officia.|Reprehenderit et ipsam. Veritatis non laudantium minima et exercitationem enim iste veniam non.|Keyboard|$723.00
82|Handmade Wooden Bacon|Voluptatum et consequatur sunt.|Consectetur tenetur est non vero. Id nihil est est et est beatae.|Chicken|$596.00
83|Fantastic Rubber Chips|Omnis culpa non totam facilis provident eum dolorum numquam id.|Voluptatum et nulla minus. Officia quis et corporis dolor nemo quia est reprehenderit ex.|Table|$426.00
84|Licensed Fresh Soap|Atque cumque dolorum voluptas dicta ut consequatur eum ut.|Expedita in repudiandae fuga voluptatem eos distinctio totam a. Omnis amet blanditiis quisquam culpa tempora qui commodi et iure.|Sausages|$780.00
85|Ergonomic Fresh Pizza|Error neque et quam laudantium quos consequatur.|Fugiat et tempore sed et id. Vel dolore voluptatem aperiam sit voluptates aut eum quia.|Shoes|$897.00
86|Ergonomic Frozen Keyboard|Veritatis ab sed voluptatibus suscipit quibusdam non.|Cum voluptatum repellendus suscipit est ut ex. Odio praesentium aut soluta similique et laudantium.|Keyboard|$618.00
87|Small Concrete Ball|Sint earum optio architecto in sit aliquam et id qui.|Consequuntur aliquam voluptates quia dolorem asperiores. Nisi sint pariatur esse eveniet et consequatur corrupti.|Mouse|$190.00
88|Awesome Fresh Computer|Praesentium dignissimos dolor.|Non molestiae dignissimos voluptatem aut excepturi quam. Aspernatur debitis facilis quis saepe placeat vitae veniam inventore ut.|Salad|$147.00
89|Tasty Soft Tuna|Voluptatem consequatur omnis dolores dolorem et voluptatibus et atque aut.|Aliquam eveniet animi natus ad consequuntur qui harum. Molestiae ducimus deserunt non aperiam alias quia voluptatibus incidunt.|Keyboard|$231.00
90|Intelligent Plastic Bacon|Delectus iste qui modi explicabo architecto possimus voluptates eaque autem.|Praesentium sunt nesciunt sint distinctio non animi voluptatum qui. Aut sequi natus officiis et ratione.|Chips|$895.00
91|Handmade Rubber Mouse|Dicta fugit quibusdam accusamus optio soluta reprehenderit fugiat.|Nemo nulla et consequatur et ut molestiae alias dolor. Aspernatur magni repudiandae.|Shoes|$219.00
92|Tasty Frozen Bike|Ea necessitatibus exercitationem molestiae voluptatem et inventore odit voluptas.|Consequuntur facilis voluptate modi incidunt quo. Sed veniam non ut reprehenderit dolor sit qui.|Shirt|$33.00
93|Tasty Concrete Chair|Aut est qui nihil qui alias aut tenetur.|Totam ipsa sunt. Odit quia minus ex consequuntur aliquid.|Fish|$847.00
94|Intelligent Cotton Bike|Repudiandae mollitia dolorem cupiditate nulla repudiandae.|Harum voluptas ab corporis doloremque nobis. Velit quisquam vel quo quo.|Fish|$718.00
95|Awesome Metal Sausages|Tempore sit vel est.|Tempore soluta repellat quia voluptatum. Sit quis sunt architecto similique voluptas.|Gloves|$108.00
96|Refined Wooden Gloves|Ratione sed fugiat et tempora.|Sapiente vero fugiat quo est animi. Rem dolore eum harum officiis voluptatem.|Salad|$923.00
97|Fantastic Concrete Bike|Quis porro magnam maxime.|Assumenda odio sit maiores omnis odit omnis reprehenderit velit dolores. Velit quibusdam adipisci ullam alias qui.|Ball|$911.00
98|Sleek Fresh Keyboard|Dolorem est commodi inventore.|Est officiis quasi. Et non modi nobis.|Cheese|$987.00
99|Handmade Cotton Bacon|Non et voluptatem exercitationem optio sint ratione.|Quibusdam error quia veritatis aut et dolorum sit sint corporis. Eum sapiente voluptatem dignissimos explicabo.|Soap|$289.00
